{
  "profile_version": "1.0",
  "profile_id": "chatgpt-image-generation@1",
  "adapter_id": "chatgpt-imagegen@1",
  "tool_family": "ChatGPT image generation",
  "model_id": "active-runtime-model",
  "observed_at": "2026-07-15T12:00:00Z",
  "capabilities": {
    "generate": "supported",
    "reference-conditioned": "supported",
    "edit": "supported",
    "mask-edit": "unknown",
    "multi-reference": "supported",
    "identity-preservation": "unknown",
    "transparent-output": "supported",
    "upscale": "unsupported",
    "exact-dimensions": "unknown",
    "deliver": "supported",
    "seed-control": "unknown"
  },
  "limits": {
    "max_references": 4,
    "max_width_px": 0,
    "max_height_px": 0
  },
  "limitations": [
    "Mask editing is not exposed in this runtime profile.",
    "Identity preservation is not guaranteed."
  ],
  "evidence": {
    "source": "Observed active tool contract",
    "verified_by": "runtime adapter evaluation"
  }
}
